{
  "checked_at": "2026-07-21T09:50:00+00:00",
  "execution_authorized": false,
  "failures": [],
  "health_fingerprint": "920adb1e34c9c7d4f15b7d222cc0b707d037d74c3d75b5774aa6bd40cfc82b63",
  "knowledge_impact": {
    "causal_performance_attribution_authorized": false,
    "execution_authorized": false,
    "impact_fingerprint": "18cc5f9142ebe44e56bc80f81081c9654f2080892d8b1f5c6e7ab85e006356aa",
    "influence_chain": {
      "broken_chain_run_count": 0,
      "critic_verified_run_count": 3,
      "director_handoff_bound_run_count": 3,
      "observed_run_count": 4,
      "retrieved_only_run_count": 1,
      "runs": [
        {
          "classification": "director_handoff_knowledge_bound",
          "critic_verified_idea_count": 7,
          "director_handoff_bound": true,
          "idea_artifact_count": 7,
          "issues": [],
          "knowledge_bound_idea_count": 7,
          "retrieved_lesson_ids": [
            "cross-pair-reproducibility-not-generalization-v1",
            "exit-frequency-insufficient-causal-evidence-v1",
            "ranging-short-temporal-retention-v1",
            "regime-directionality-rotation-no-threshold-search-v1"
          ],
          "retrieved_pattern_ids": [
            "cross-sectional-factor-ranking",
            "funding-basis-arbitrage",
            "inventory-aware-market-making",
            "multi-symbol-timeframe-composition"
          ],
          "run_id": "discovery-run-045a763176bbbea2",
          "selected_idea_considered_lesson_ids": [
            "cross-pair-reproducibility-not-generalization-v1",
            "exit-frequency-insufficient-causal-evidence-v1",
            "ranging-short-temporal-retention-v1",
            "regime-directionality-rotation-no-threshold-search-v1"
          ],
          "selected_idea_id": "additional-pair-manifest-inventory-v1",
          "selected_idea_used_pattern_ids": [
            "multi-symbol-timeframe-composition"
          ],
          "selection_fingerprint": "e9f5e59cae026c0ac424780c815021d105c0c946377d1b9314d67f6e06cf8d53",
          "selection_id": "knowledge-selection-6be68ca88129ebc3",
          "semantic_duplicate_idea_count": 0
        },
        {
          "classification": "director_handoff_knowledge_bound",
          "critic_verified_idea_count": 6,
          "director_handoff_bound": true,
          "idea_artifact_count": 6,
          "issues": [],
          "knowledge_bound_idea_count": 6,
          "retrieved_lesson_ids": [
            "cross-pair-reproducibility-not-generalization-v1",
            "exit-frequency-insufficient-causal-evidence-v1",
            "ranging-short-temporal-retention-v1",
            "regime-directionality-rotation-no-threshold-search-v1"
          ],
          "retrieved_pattern_ids": [
            "cross-sectional-factor-ranking",
            "funding-basis-arbitrage",
            "multi-symbol-timeframe-composition",
            "multi-timeframe-regime-gating"
          ],
          "run_id": "discovery-run-1ae473d06c0e5610",
          "selected_idea_considered_lesson_ids": [
            "cross-pair-reproducibility-not-generalization-v1",
            "exit-frequency-insufficient-causal-evidence-v1",
            "ranging-short-temporal-retention-v1",
            "regime-directionality-rotation-no-threshold-search-v1"
          ],
          "selected_idea_id": "bnb-xrp-distribution-shift-profile-v1",
          "selected_idea_used_pattern_ids": [
            "multi-symbol-timeframe-composition"
          ],
          "selection_fingerprint": "d8a7dbd4278c633a88a7242469792f2359db40708cd843b004cae78e6d873cb9",
          "selection_id": "knowledge-selection-84feefa54f4bed99",
          "semantic_duplicate_idea_count": 0
        },
        {
          "classification": "director_handoff_knowledge_bound",
          "critic_verified_idea_count": 6,
          "director_handoff_bound": true,
          "idea_artifact_count": 6,
          "issues": [],
          "knowledge_bound_idea_count": 6,
          "retrieved_lesson_ids": [
            "cross-pair-reproducibility-not-generalization-v1",
            "exit-frequency-insufficient-causal-evidence-v1",
            "ranging-short-temporal-retention-v1",
            "regime-directionality-rotation-no-threshold-search-v1"
          ],
          "retrieved_pattern_ids": [
            "cross-sectional-factor-ranking",
            "explicit-order-intent",
            "multi-symbol-timeframe-composition",
            "multi-timeframe-regime-gating"
          ],
          "run_id": "discovery-run-66c83d41c84027eb",
          "selected_idea_considered_lesson_ids": [
            "cross-pair-reproducibility-not-generalization-v1",
            "exit-frequency-insufficient-causal-evidence-v1",
            "ranging-short-temporal-retention-v1",
            "regime-directionality-rotation-no-threshold-search-v1"
          ],
          "selected_idea_id": "bnb-xrp-timeframe-coherence-v1",
          "selected_idea_used_pattern_ids": [
            "multi-symbol-timeframe-composition"
          ],
          "selection_fingerprint": "810651b90b0d5a1ff2ce32ec019ed0023678883bdd15ac9494f9110140699973",
          "selection_id": "knowledge-selection-9e8744bc518b8985",
          "semantic_duplicate_idea_count": 0
        },
        {
          "classification": "retrieved_only_no_idea_artifacts",
          "critic_verified_idea_count": 0,
          "director_handoff_bound": false,
          "idea_artifact_count": 0,
          "issues": [],
          "knowledge_bound_idea_count": 0,
          "retrieved_lesson_ids": [
            "cross-pair-reproducibility-not-generalization-v1",
            "exit-frequency-insufficient-causal-evidence-v1",
            "ranging-short-temporal-retention-v1",
            "regime-directionality-rotation-no-threshold-search-v1"
          ],
          "retrieved_pattern_ids": [
            "cross-sectional-factor-ranking",
            "funding-basis-arbitrage",
            "multi-symbol-timeframe-composition",
            "multi-timeframe-regime-gating"
          ],
          "run_id": "discovery-run-b3939e7db2a82c12",
          "selected_idea_considered_lesson_ids": [],
          "selected_idea_id": null,
          "selected_idea_used_pattern_ids": [],
          "selection_fingerprint": "58fbbce41429d81c98f519038d8e72d2dfad66d0a3790c1611a80ac5b7c15827",
          "selection_id": "knowledge-selection-3cfac267cbcf0825",
          "semantic_duplicate_idea_count": 0
        }
      ]
    },
    "knowledge_snapshot_fingerprint": "86b5d8da34601a7ff59e94029ccf43914d83b14f06764962425875cdbd85ecbc",
    "lesson_usage": {
      "formal_count": 9,
      "items": [
        {
          "discovery_run_ids": [],
          "item_id": "candidate-module-cache-shadowing-v1",
          "retrieval_count": 0
        },
        {
          "discovery_run_ids": [],
          "item_id": "chan-confirmed-higher-low-direct-entry-v1",
          "retrieval_count": 0
        },
        {
          "discovery_run_ids": [
            "discovery-run-045a763176bbbea2",
            "discovery-run-1ae473d06c0e5610",
            "discovery-run-66c83d41c84027eb",
            "discovery-run-b3939e7db2a82c12"
          ],
          "item_id": "cross-pair-reproducibility-not-generalization-v1",
          "retrieval_count": 4
        },
        {
          "discovery_run_ids": [
            "discovery-run-045a763176bbbea2",
            "discovery-run-1ae473d06c0e5610",
            "discovery-run-66c83d41c84027eb",
            "discovery-run-b3939e7db2a82c12"
          ],
          "item_id": "exit-frequency-insufficient-causal-evidence-v1",
          "retrieval_count": 4
        },
        {
          "discovery_run_ids": [
            "discovery-run-045a763176bbbea2",
            "discovery-run-1ae473d06c0e5610",
            "discovery-run-66c83d41c84027eb",
            "discovery-run-b3939e7db2a82c12"
          ],
          "item_id": "ranging-short-temporal-retention-v1",
          "retrieval_count": 4
        },
        {
          "discovery_run_ids": [
            "discovery-run-045a763176bbbea2",
            "discovery-run-1ae473d06c0e5610",
            "discovery-run-66c83d41c84027eb",
            "discovery-run-b3939e7db2a82c12"
          ],
          "item_id": "regime-directionality-rotation-no-threshold-search-v1",
          "retrieval_count": 4
        },
        {
          "discovery_run_ids": [],
          "item_id": "semantic-equivalence-current-artifact-binding-v1",
          "retrieval_count": 0
        },
        {
          "discovery_run_ids": [],
          "item_id": "single-threshold-ranging-search-exhausted-v1",
          "retrieval_count": 0
        },
        {
          "discovery_run_ids": [],
          "item_id": "strategy-family-baseline-single-structure-hypothesis-v1",
          "retrieval_count": 0
        }
      ],
      "never_retrieved_count": 5,
      "never_retrieved_ids": [
        "candidate-module-cache-shadowing-v1",
        "chan-confirmed-higher-low-direct-entry-v1",
        "semantic-equivalence-current-artifact-binding-v1",
        "single-threshold-ranging-search-exhausted-v1",
        "strategy-family-baseline-single-structure-hypothesis-v1"
      ],
      "retrieved_count": 4
    },
    "observed_discovery_runs": 4,
    "pattern_usage": {
      "formal_count": 12,
      "items": [
        {
          "discovery_run_ids": [],
          "item_id": "causal-indicator-validation",
          "retrieval_count": 0
        },
        {
          "discovery_run_ids": [
            "discovery-run-045a763176bbbea2",
            "discovery-run-1ae473d06c0e5610",
            "discovery-run-66c83d41c84027eb",
            "discovery-run-b3939e7db2a82c12"
          ],
          "item_id": "cross-sectional-factor-ranking",
          "retrieval_count": 4
        },
        {
          "discovery_run_ids": [],
          "item_id": "deterministic-research-live-parity",
          "retrieval_count": 0
        },
        {